{
  "$schema": "../schema/etalon-precizie.schema.json",
  "_": "Fișă de verificare pentru precizia extractorului de referințe. Vezi scripts/etalon_precizie.py.",
  "amprenta": "a0e4ac3f296dfc5537824f2f5c91b9c3",
  "candidati_total": 283,
  "in_esantion": 120,
  "intrebare": "În pasajul de mai jos, `text` este o citare reală a actului `act`? Răspunsul intră în data/etalon-precizie-verdicte.json ca true / false / null.",
  "elemente": [
    {
      "cheie": "decizie-815-2015.html:10422:constitutie",
      "fisier": "decizie-815-2015.html",
      "act": "constitutie",
      "text": "Constituției",
      "inainte": "portul întocmit de judecătorul-raportor, concluziile reprezentanților părților prezenți la dezbateri, concluziile scrise depuse la dosar, concluziile procurorului, dispozițiile legale criticate, raportate la prevederile ",
      "dupa": ", precum și Legea nr. 47/1992 , reține următoarele: 12. Curtea Constituțională a fost legal sesizată și este competentă, potrivit dispozițiilor art. 146 lit. d) din Constituție, precum și ale art. 1 alin. (2), ale art. 2"
    },
    {
      "cheie": "decizie-815-2015.html:10578:constitutie",
      "fisier": "decizie-815-2015.html",
      "act": "constitutie",
      "text": "art. 146 lit. d) din Constituție",
      "inainte": "orului, dispozițiile legale criticate, raportate la prevederile Constituției, precum și Legea nr. 47/1992 , reține următoarele: 12. Curtea Constituțională a fost legal sesizată și este competentă, potrivit dispozițiilor ",
      "dupa": ", precum și ale art. 1 alin. (2), ale art. 2, 3, 10 și 29 din Legea nr. 47/1992 , să soluționeze excepția de neconstituționalitate. 13. Obiectul excepției de neconstituționalitate îl constituie dispozițiile art. 1 și 4 d"
    },
    {
      "cheie": "decizie-815-2015.html:10648:lege-47-1992",
      "fisier": "decizie-815-2015.html",
      "act": "lege-47-1992",
      "text": "art. 2, 3, 10 și 29 din Legea nr. 47/1992",
      "inainte": "tuției, precum și Legea nr. 47/1992 , reține următoarele: 12. Curtea Constituțională a fost legal sesizată și este competentă, potrivit dispozițiilor art. 146 lit. d) din Constituție, precum și ale art. 1 alin. (2), ale ",
      "dupa": " , să soluționeze excepția de neconstituționalitate. 13. Obiectul excepției de neconstituționalitate îl constituie dispozițiile art. 1 și 4 din Ordonanța de urgență a Guvernului nr. 65/2013 pentru stabilirea unor măsuri "
    },
    {
      "cheie": "decizie-815-2015.html:10656:lege-47-1992",
      "fisier": "decizie-815-2015.html",
      "act": "lege-47-1992",
      "text": "3, 10 și 29 din Legea nr. 47/1992",
      "inainte": "precum și Legea nr. 47/1992 , reține următoarele: 12. Curtea Constituțională a fost legal sesizată și este competentă, potrivit dispozițiilor art. 146 lit. d) din Constituție, precum și ale art. 1 alin. (2), ale art. 2, ",
      "dupa": " , să soluționeze excepția de neconstituționalitate. 13. Obiectul excepției de neconstituționalitate îl constituie dispozițiile art. 1 și 4 din Ordonanța de urgență a Guvernului nr. 65/2013 pentru stabilirea unor măsuri "
    },
    {
      "cheie": "decizie-815-2015.html:10659:lege-47-1992",
      "fisier": "decizie-815-2015.html",
      "act": "lege-47-1992",
      "text": "10 și 29 din Legea nr. 47/1992",
      "inainte": "cum și Legea nr. 47/1992 , reține următoarele: 12. Curtea Constituțională a fost legal sesizată și este competentă, potrivit dispozițiilor art. 146 lit. d) din Constituție, precum și ale art. 1 alin. (2), ale art. 2, 3, ",
      "dupa": " , să soluționeze excepția de neconstituționalitate. 13. Obiectul excepției de neconstituționalitate îl constituie dispozițiile art. 1 și 4 din Ordonanța de urgență a Guvernului nr. 65/2013 pentru stabilirea unor măsuri "
    },
    {
      "cheie": "decizie-815-2015.html:10665:lege-47-1992",
      "fisier": "decizie-815-2015.html",
      "act": "lege-47-1992",
      "text": "29 din Legea nr. 47/1992",
      "inainte": " Legea nr. 47/1992 , reține următoarele: 12. Curtea Constituțională a fost legal sesizată și este competentă, potrivit dispozițiilor art. 146 lit. d) din Constituție, precum și ale art. 1 alin. (2), ale art. 2, 3, 10 și ",
      "dupa": " , să soluționeze excepția de neconstituționalitate. 13. Obiectul excepției de neconstituționalitate îl constituie dispozițiile art. 1 și 4 din Ordonanța de urgență a Guvernului nr. 65/2013 pentru stabilirea unor măsuri "
    },
    {
      "cheie": "decizie-815-2015.html:10827:oug-65-2013",
      "fisier": "decizie-815-2015.html",
      "act": "oug-65-2013",
      "text": "4 din Ordonanța de urgență a Guvernului nr. 65/2013",
      "inainte": "ție, precum și ale art. 1 alin. (2), ale art. 2, 3, 10 și 29 din Legea nr. 47/1992 , să soluționeze excepția de neconstituționalitate. 13. Obiectul excepției de neconstituționalitate îl constituie dispozițiile art. 1 și ",
      "dupa": " pentru stabilirea unor măsuri privind încadrarea absolvenților Academiei de Poliție \"Alexandru Ioan Cuza\", promoția 2013, publicată în Monitorul Oficial al României, Partea I, nr. 386 din 28 iunie 2013, aprobată prin Le"
    },
    {
      "cheie": "decizie-815-2015.html:11096:lege-331-2013",
      "fisier": "decizie-815-2015.html",
      "act": "lege-331-2013",
      "text": "Legea nr. 331/2013",
      "inainte": "13 pentru stabilirea unor măsuri privind încadrarea absolvenților Academiei de Poliție \"Alexandru Ioan Cuza\", promoția 2013, publicată în Monitorul Oficial al României, Partea I, nr. 386 din 28 iunie 2013, aprobată prin ",
      "dupa": " , publicată în Monitorul Oficial al României, Partea I, nr. 774 din 11 decembrie 2013, având următorul cuprins: - Art. 1: \"Prezenta ordonanță de urgență se aplică absolvenților Academiei de Poliție \"Alexandru Ioan Cuza\""
    },
    {
      "cheie": "decizie-815-2015.html:13102:constitutie",
      "fisier": "decizie-815-2015.html",
      "act": "constitutie",
      "text": "Constituție",
      "inainte": "12 la această convenție, privind interzicerea generală a discriminării, raportate la art. 11 privind dreptul internațional și dreptul intern și art. 20 referitor la tratatele internaționale privind drepturile omului din ",
      "dupa": ". 16. Examinând excepția de neconstituționalitate, Curtea reține că, potrivit art. 21 alin. (1) din Legea nr. 360/2002 privind Statutul polițistului, publicată în Monitorul Oficial al României, Partea I, nr. 440 din 24 i"
    },
    {
      "cheie": "decizie-815-2015.html:14135:oug-54-2011",
      "fisier": "decizie-815-2015.html",
      "act": "oug-54-2011",
      "text": "art. 2 din Ordonanța de urgență a Guvernului nr. 54/2011",
      "inainte": " 10 ani, potrivit angajamentului încheiat în acest sens.\" 17. Cu privire la exonerarea de la plata cheltuielilor de întreținere efectuate pe timpul școlarizării, Curtea reține că relevante sunt următoarele dispoziții: - ",
      "dupa": " pentru stabilirea unor măsuri privind încadrarea în limita alocată cheltuielilor de personal din Ministerul Afacerilor Interne pentru anul 2011, publicată în Monitorul Oficial al României, Partea I, nr. 433 din 21 iunie"
    },
    {
      "cheie": "decizie-815-2015.html:15858:lege-213-2012",
      "fisier": "decizie-815-2015.html",
      "act": "lege-213-2012",
      "text": "Legea nr. 213/2012",
      "inainte": " ale instituțiilor de formare profesională inițială din sistemul de apărare națională, ordine publică și siguranță națională, publicată în Monitorul Oficial al României, Partea I, nr. 441 din 3 iulie 2012, aprobată prin ",
      "dupa": " : \"În lipsa unei oferte de încadrare din partea instituțiilor pentru care s-a realizat formarea profesională, absolvenții promoțiilor anului 2012 din instituțiile de formare profesională inițială prevăzute la art. 1 car"
    },
    {
      "cheie": "decizie-815-2015.html:18969:oug-65-2013",
      "fisier": "decizie-815-2015.html",
      "act": "oug-65-2013",
      "text": "Ordonanței de urgență a Guvernului nr. 65/2013",
      "inainte": "it căreia exonerarea de la plata cheltuielilor de școlarizare nu a operat și în privința absolvenților din promoția 2010, care au încetat raportul de serviciu cu Ministerul Afacerilor Interne în perioada de activitate a ",
      "dupa": " , ceea ce creează discriminări, nu poate fi primită. Curtea a statuat în jurisprudența sa că art. 16 din Constituție \"vizează egalitatea în drepturi între cetățeni în ceea ce privește recunoașterea în favoarea acestora "
    },
    {
      "cheie": "decizie-815-2015.html:21367:lege-360-2002",
      "fisier": "decizie-815-2015.html",
      "act": "lege-360-2002",
      "text": "art. 70 din Legea nr. 360/2002",
      "inainte": "ei 2010, care doreau încetarea raporturilor de serviciu cu ministerul în perioada prevăzută de Ordonanța de urgență a Guvernului nr. 65/2013 , adică în perioada 28 iunie 2013-30 noiembrie 2013, li se aplicau prevederile ",
      "dupa": " , potrivit cărora trebuie să restituie proporțional cheltuielile de școlarizare făcute cu pregătirea pentru nevoile Ministerului Afacerilor Interne. 22. Este adevărat că reglementarea criticată diferă - sub aspectul per"
    },
    {
      "cheie": "decizie-815-2015.html:21727:oug-54-2011",
      "fisier": "decizie-815-2015.html",
      "act": "oug-54-2011",
      "text": "Ordonanța de urgență a Guvernului nr. 54/2011",
      "inainte": "evoile Ministerului Afacerilor Interne. 22. Este adevărat că reglementarea criticată diferă - sub aspectul persoanelor care beneficiază de exonerarea de la plata cheltuielilor de școlarizare - față de cea prevăzută prin ",
      "dupa": " (aceasta din urmă reglementând faptul că și polițiștii în activitate care încetează raporturile de serviciu cu ministerul în perioada prevăzută beneficiază de exonerare), însă, fiind vorba despre un beneficiu acordat de"
    },
    {
      "cheie": "decizie-815-2015.html:22421:oug-65-2013",
      "fisier": "decizie-815-2015.html",
      "act": "oug-65-2013",